Icon,Name,Detail,Time,Review,Unnamed: 5,Unnamed: 6,Unnamed: 7,Unnamed: 8,Detected_Language
https://lh3.googleusercontent.com/a-/ALV-UjUR3rttbsqBhmtaqifEAxyTvNSr2_dCmGGDIKcV-rmaFDCwxeUk=w40-h40-p-rp-mo-ba4-br100,Benjamin Plummer,Local Guide · 47 reviews,3 years ago,great place bring dog let leed great seating area theres shelter bad weather aint bad,,,Like,Share,en
https://lh3.googleusercontent.com/a-/ALV-UjXFsLio4GzZ92pOksdT51xBQNcquYBr80ba3odQueID1dGN8iKp=w40-h40-p-rp-mo-ba2-br100,Lars Wannop,Local Guide · 13 reviews · 7 photos,4 years ago,probably best fenced dog park inner melbourne grass well maintained dogs friendly well socialised plenty big dogs little dogs,,,Like,Share,en
https://lh3.googleusercontent.com/a/ACg8ocJGJOaX7Ezn4T690HELUtb5AcbqG-MV7OIH9bxE6GwF7VQLYADj=w40-h40-p-rp-mo-ba2-br100,Fatema Hussain,Local Guide · 23 reviews · 3 photos,3 years ago,great place leash dog park pup loves across woolies super convenient,,,Like,Share,en
https://lh3.googleusercontent.com/a/ACg8ocLaJg-GgCv8NWfBAKEPdsybay-Zbq2g-0Vc4fhERtTRQ1Akbw=w40-h40-p-rp-mo-ba4-br100,Danielle Walker,Local Guide · 90 reviews · 20 photos,2 years ago,really great dog park good size fully fenced lovely people issue winter mud,,,Like,Share,en
https://lh3.googleusercontent.com/a-/ALV-UjVNCm9YyoV97tw3irw6wugaur6eLI-VAEXTyE0JCEhc4Vh3HdtboQ=w40-h40-p-rp-mo-ba4-br100,Fatemeh Moztarzadeh,Local Guide · 108 reviews · 92 photos,3 years ago,good place take dogs play fenced safe normally dogs,,,Like,Share,en
https://lh3.googleusercontent.com/a-/ALV-UjXKQV7BxLkLjT0RuwwYG70CyASsQmWJDqag4B_vAvvgiKL_8iVz=w40-h40-p-rp-mo-br100,Daniel Osegueda,16 reviews,3 years ago,bad spot dog park little small good people well behaved dogs,,,Like,Share,en
https://lh3.googleusercontent.com/a-/ALV-UjWs1tCgtgnD_G9MFXHcnLZLLXRKXEcbVr5jiXmlThRmdrs37MgYYQ=w40-h40-p-rp-mo-ba4-br100,Mas_Aus,Local Guide · 93 reviews · 45 photos,3 years ago,owners friendly looking dog safe fun park dog recommended,,,Like,Share,da
https://lh3.googleusercontent.com/a-/ALV-UjV1UxzQzIc4ywKdRGrMGF6jL8EVG42tSD3646D_ZbrtOhbtEl98Lw=w40-h40-p-rp-mo-ba4-br100,Frank Ziegler,Local Guide · 26 reviews · 149 photos,7 years ago,fully fenced many dogs good day great place take pooch lead run,,,Like,Share,en
https://lh3.googleusercontent.com/a/ACg8ocJLALX1MRqkzwgIFo4XwLR3tUzFC6LAjl2cjCAuyEl1jcnj4w=w40-h40-p-rp-mo-ba3-br100,Callum Andrew,Local Guide · 36 reviews · 7 photos,5 years ago,great enclosures area social dogs run around water bowls provided fountains,,,Like,Share,en
https://lh3.googleusercontent.com/a/ACg8ocIFSQGI-uqm1npRmBywk9jkvzMI3uDqVxC7EVLmyzPGdb-xpw=w40-h40-p-rp-mo-br100,Sayaka Hayashi,5 reviews · 3 photos,5 years ago,great park dog see people leave doggy poo everywhere,,,Like,Share,en
https://lh3.googleusercontent.com/a-/ALV-UjUY7UCJPiDR2XWkzAyykqk-TamUwh2YCWX9Vxqu52E3HJ4BPiKb=w40-h40-p-rp-mo-ba3-br100,Ronald Macfarlane,Local Guide · 46 reviews · 1 photo,2 years ago,well behaved dogs owners great community excellent play spot dogs sizes,,,,Share,en
https://lh3.googleusercontent.com/a-/ALV-UjUNK2hzpLprzjXAWAxLhhSahtCQRRJQwEljPHxd7vfotmsmaXC-7w=w40-h40-p-rp-mo-ba5-br100,T T,Local Guide · 173 reviews · 365 photos,8 years ago,nice place go dog let run people still dont collect dogs waste everywhere,,,Like,Share,en
https://lh3.googleusercontent.com/a-/ALV-UjVbhICbvdzC9nrbEyNnzfz2vlUkR5hDJTkuwlB_SxGij3bpBfvF=w40-h40-p-rp-mo-ba3-br100,Luke Davidson,Local Guide · 47 reviews · 15 photos,4 years ago,nice enclosed dog park water bowls heaps green grass lots friendly dogs,,,Like,Share,en
https://lh3.googleusercontent.com/a-/ALV-UjWPfqk2JZtAT2awrbzdCLfSVDhYqJfa3e9RCp_CKZ2r7WYbbqMKHg=w40-h40-p-rp-mo-ba3-br100,Adrian Horsman,Local Guide · 74 reviews · 54 photos,a year ago,great fenced offleash dog park,,,Like,Share,en
https://lh3.googleusercontent.com/a/ACg8ocLp_VGb6kOK6PskaAq8YjtvFPdmuo5Aj2ALdkif5AiRoeC5uw=w40-h40-p-rp-mo-ba3-br100,Hayley Stevens,Local Guide · 41 reviews · 75 photos,4 years ago,neat little dog park small dog section many seats entrances cafe nearby,,,Like,Share,en
https://lh3.googleusercontent.com/a-/ALV-UjUPNpFIxxozpjoDmfR71ZdT4VCYjbHAln9isXYOTyx5XRIkmHme=w40-h40-p-rp-mo-ba4-br100,Victoria Domingos,Local Guide · 92 reviews · 24 photos,5 years ago,great place fun dog friendly people pets dog loves going,,,Like,Share,en
https://lh3.googleusercontent.com/a-/ALV-UjUDHixZQWjaWl1M_F7okKSM1x9XQK4apeYV4dS8wOJKclWb4hY9=w40-h40-p-rp-mo-ba3-br100,Chen Chen,Local Guide · 28 reviews · 18 photos,4 years ago,great place dogs relax especially summer winter little bit mud less grass,,,Share,Like,en
https://lh3.googleusercontent.com/a-/ALV-UjW4e71AWVodcVFk81ap-mdfXbcFAoGuYpGwYYhfEVfVYDriGGMWnw=w40-h40-p-rp-mo-ba5-br100,J & D,Local Guide · 148 reviews · 10 photos,3 years ago,well fenced clean great size plenty seating amenities lots friendly people fur babies aaa,,,Like,Share,en
https://lh3.googleusercontent.com/a-/ALV-UjWUR_NY7sRjoGhzaOU7MuDyZ7EhUWVB8iBnu6-0lijiXbMWz-Jl=w40-h40-p-rp-mo-ba4-br100,AYO ITS “AYO ITS CAM” CAM,Local Guide · 156 reviews · 191 photos,2 years ago,clean alot open space always dogs around dog play chase,,,Like,Share,en
https://lh3.googleusercontent.com/a-/ALV-UjXWA88sRRlet9MDjswgwRXD5aDpVQ4dD4nK4wz14kprKiASTA7H=w40-h40-p-rp-mo-ba4-br100,Surendra bade,Local Guide · 33 reviews · 355 photos,4 years ago,best hang dog,,,Share,Like,da
https://lh3.googleusercontent.com/a-/ALV-UjWZElps277SD1ylehA07rAkhYWbEVXTsmqLOoadLvnR8ZAx5rjY=w40-h40-p-rp-mo-ba4-br100,Reece Russell,Local Guide · 96 reviews · 42 photos,7 years ago,small dog cant get shed want usually fun dogs people play,,,Like,Share,en
https://lh3.googleusercontent.com/a-/ALV-UjXRPcWIHk4R13w5LolrGOr0lDA-bPvO4qyM-36QyZRAhqXScLhY=w40-h40-p-rp-mo-ba5-br100,Le-man Nebby,Local Guide · 182 reviews · 298 photos,8 years ago,great place let dog run around leash fenced park plenty parking,,,Like,Share,en
https://lh3.googleusercontent.com/a-/ALV-UjWQTiNVZ_8Sja_cfiv3pN9QcBVRVZPJ-hLDRuMU41kB-aK5oLU=w40-h40-p-rp-mo-br100,Susan Susan,64 reviews · 47 photos,6 years ago,great little offlead park itll get vbusy apartments going across road live dog human patrons vfriendly,,,Like,Share,en
https://lh3.googleusercontent.com/a-/ALV-UjVYQOjbBmZNI5QK9swYzF5-VfgfMSp5gSBNoCwM43aLs5SB15u5AA=w40-h40-p-rp-mo-ba5-br100,Tracey Petersen-Esposito,Local Guide · 177 reviews · 523 photos,4 years ago,good inner city dog park spacious fenced council provides dog bags easy street parking,,,Like,Share,en
https://lh3.googleusercontent.com/a/ACg8ocIFuKp-JI9Z5cd9vjcQWwUI1sZoNJgu3RzvgT5f9mQeheaEZg=w40-h40-p-rp-mo-ba2-br100,Matthew Mc Grath,Local Guide · 10 reviews,4 years ago,perfect place dog lovers plenty room fur babies run around,,,Like,Share,en
https://lh3.googleusercontent.com/a-/ALV-UjXDBzA9fVlPS1SEyWm85rl9Jf06BbPlQsaY6jXGZ7-2gXAFePaVLg=w40-h40-p-rp-mo-ba4-br100,Bianca Paine,Local Guide · 70 reviews · 197 photos,6 years ago,love dog park great community fur friends owners friendly great facilities,,,,Share,en
https://lh3.googleusercontent.com/a-/ALV-UjXxA010194Pk_evCnawAmSBzhyd4_kZCshSBTm06zTSkxvGpuyBZQ=w40-h40-p-rp-mo-ba6-br100,Luis Aranguren,"Local Guide · 263 reviews · 1,003 photos",5 years ago,owners bring bigger dogs later evening days dont interact precious little fluffy ones,,,,Share,en
https://lh3.googleusercontent.com/a-/ALV-UjXE7ziyXRVjOKsxT9ArU86n9LMB5_1q_J4oFPxZuWBZ6RWxkYAt=w40-h40-p-rp-mo-ba3-br100,Adam Blackburn,Local Guide · 37 reviews · 1 photo,7 years ago,dogs love place owners responsibly fully fenced,,,,Share,en
https://lh3.googleusercontent.com/a-/ALV-UjVyOef5aoJ3nEVzogCfDhw_xCgFE9oclSO3RzYSC_wGeDjPDBLTsQ=w40-h40-p-rp-mo-ba3-br100,Jiuliana McKenzie,Local Guide · 82 reviews · 34 photos,a year ago,lovely dog park fur babies,,,Like,Share,no
https://lh3.googleusercontent.com/a-/ALV-UjXeLll4QfF0Dt6EXTHdwQ-VQ3ZAtPPTuoQ-ekyJ-0ASBIlhetg=w40-h40-p-rp-mo-ba2-br100,Christopher,Local Guide · 26 reviews,a year ago,ordered drink never came service terrible works well dog park,,,Like,Share,en
https://lh3.googleusercontent.com/a-/ALV-UjVWQojHkGaRVifHlbj_7tdugtlm2tCrDWYJZX09bqAjAzJ7T6XS=w40-h40-p-rp-mo-ba5-br100,Selena Rosier,Local Guide · 98 reviews · 650 photos,8 years ago,stopped cause area great dog park users need pick furbabies bit,,,Like,Share,en
https://lh3.googleusercontent.com/a-/ALV-UjX6omUKBf2fQD51Q67cAIspH8xwyxxF-2nqqO_ZeiwQ93tgdMAL=w40-h40-p-rp-mo-br100,Chris Vesty,560 reviews,3 years ago,social little dog park seats water rubbish bins plastic bags dog poo right across road woolworths,,,,Share,en
https://lh3.googleusercontent.com/a-/ALV-UjV2tk16JvDvNR3BwbYERx6TUSfpYRDH897M8wZBtSQeam8_IsZAnQ=w40-h40-p-rp-mo-ba6-br100,Jay,"Local Guide · 650 reviews · 1,249 photos",7 years ago,great little city dog park use whenever take dog vets across road,,,Like,Share,en
https://lh3.googleusercontent.com/a/ACg8ocLkbyLWljZ01Q4TyW5Si-PXlacuTbscRZgEc9a1j-J6i0BYMrs=w40-h40-p-rp-mo-ba4-br100,Kathy Pesavento,Local Guide · 90 reviews · 52 photos,7 years ago,great park walking letting dog lead great fencing,,,Like,Share,en
https://lh3.googleusercontent.com/a/ACg8ocK3ln9kBSY1Swm46hN2VxfffbR5C1K_qppV86up_aqFQH2ErQ=w40-h40-p-rp-mo-ba4-br100,Elijah Wade,Local Guide · 107 reviews · 22 photos,a year ago,grate dog park fully enclosed,,,Like,Share,en
https://lh3.googleusercontent.com/a-/ALV-UjWxSTgPOYOc8mXyF60q6rWituE22edecZUH0qEBWTCdM9REaj6V=w40-h40-p-rp-mo-ba2-br100,Lisa Lisa,Local Guide · 28 reviews,5 years ago,food staff nice comes patrons st vinnies food bans pack mere chimpanzees,,,Like,Share,en
https://lh3.googleusercontent.com/a/ACg8ocL3QVXC8_sWqUFRRIIyMHPKkgBl-3vgjMBw9Kb-7ghEGbsAyvJc=w40-h40-p-rp-mo-ba4-br100,Evan Melbourne,Local Guide · 160 reviews · 14 photos,2 years ago,popular little dog park plenty pooches best friend play,,,Like,Share,en
https://lh3.googleusercontent.com/a-/ALV-UjUS3_jzw4FYKy_CYJQgss4xaIrORvhBPE1EjLbehWo5-GOcUKMQOA=w40-h40-p-rp-mo-br100,gruff,76 reviews,7 years ago,favourite leash dog park melbourne soooooooooooo friendly great park,,,Like,Share,en
https://lh3.googleusercontent.com/a/ACg8ocJeNZQHU7Bv571zGy6E2Nb8Mhq98J7WgUuIdGKWjAQ8P0j_yA=w40-h40-p-rp-mo-ba3-br100,Amanda Holten,Local Guide · 78 reviews,5 years ago,great fun kids running track older ones beaut place hang family accommodates children ages,,,Like,Share,en
https://lh3.googleusercontent.com/a/ACg8ocK3pC-BwjA5s3aOcDCsWc5XL3ZiSoSu9CdcO9znYSX6hqLBTA=w40-h40-p-rp-mo-br100,Wolfgang Henry,12 reviews,5 years ago,great open space water dog bags etc loads fun always furry friend,,,Like,Share,en
https://lh3.googleusercontent.com/a/ACg8ocJ0OliM5jirVIWjkp-neUtGerzdxpYfP5RF-sJP9sB74YGHww=w40-h40-p-rp-mo-br100,paul dunn,53 reviews · 44 photos,a year ago,plenty room small dog get fence,,,Like,Share,nl
https://lh3.googleusercontent.com/a-/ALV-UjUjN5lyjwXDasdCMNo2S6yFgaBGDJ5KLorz97ftoe-Xcc3hyTP9WQ=w40-h40-p-rp-mo-ba4-br100,Sarah Hartree,Local Guide · 172 reviews · 38 photos,6 years ago,great clean park let dogs lead,,,Like,Share,en
https://lh3.googleusercontent.com/a-/ALV-UjWbhB8RxcoIQsDgey2cCNYrR1YT25H5C1w-TR3Ss_su2mejOOU=w40-h40-p-rp-mo-br100,Speeding Storm,14 reviews,3 years ago,easy relax crowded tons fun dog,,,Like,Share,en
https://lh3.googleusercontent.com/a-/ALV-UjVJTmRPy4JClfSRj2PiclO9WMj_RVkeqIkHVsdCLd_HFkLtuUQ=w40-h40-p-rp-mo-br100,Lopez Lopez,4 reviews,4 years ago,puppy happy playing park highly recommend,,,Like,Share,en
https://lh3.googleusercontent.com/a/ACg8ocJbhgUhcB6jxQwMHtV9M_bUEh8BWCX6wMIRllVWYhoa-yQyhw=w40-h40-p-rp-mo-ba3-br100,Kody Bullock,Local Guide · 26 reviews,7 years ago,great fenced park dog run wild socialize,,,Like,Share,en
https://lh3.googleusercontent.com/a-/ALV-UjUgmaJCmjo0Jn6eRZEtNm2-zqQqq046jmACsJ7E40NLOgEB0xVm=w40-h40-p-rp-mo-ba3-br100,Pauline Woolcock,Local Guide · 33 reviews · 39 photos,3 years ago,good lead dog park wonderful variety dogs,,,Like,Share,af
https://lh3.googleusercontent.com/a/ACg8ocJAcG4c2sibgb3QO5-ZiV8M5_Yz8pynap_Kz6vhoVunMWDryA=w40-h40-p-rp-mo-br100,Ranald Houston,1 review,3 years ago,great variety well behaved friendly dogs owners,,,Like,Share,en
https://lh3.googleusercontent.com/a-/ALV-UjW0ssLXnr6Bn9r1vVELlk6zeR-_tT5J34pxI1b62lfivIc0p7X3=w40-h40-p-rp-mo-ba4-br100,Rob Canning,Local Guide · 179 reviews · 103 photos,7 years ago,good park single entry gates problem lot dogs,,,Like,Share,en
https://lh3.googleusercontent.com/a-/ALV-UjXh6Ht4y0p9KF7FDyoHWxcen-Pi7bSsbaa_OVUZ36a0odi41_i9vQ=w40-h40-p-rp-mo-ba2-br100,Aidan,Local Guide · 14 reviews · 6 photos,5 years ago,excellent fenced social dog park gets quite busy,,,Like,Share,ca
https://lh3.googleusercontent.com/a-/ALV-UjVWu0mv7S4nI9PviNxkuBOy0oLXoZOKEgl3w8NElgh36RKb2WJPwA=w40-h40-p-rp-mo-ba5-br100,Romeo,Local Guide · 364 reviews · 173 photos,5 years ago,nice place bring dogs enjoy playing,,,Like,Share,en
https://lh3.googleusercontent.com/a/ACg8ocKlwHmNrun0BarHdGZjm0xYDhje8gcV745Uc91ByWSoWgcxaw=w40-h40-p-rp-mo-ba4-br100,Daniel,Local Guide · 57 reviews · 13 photos,5 years ago,great little offleash park plenty space still eyesightearshot,,,Like,Share,en
https://lh3.googleusercontent.com/a/ACg8ocLUckYZcxq9F_glLAZ7EA4bDPn8MoVrDGTRmBtErAN-F7CUDg=w40-h40-p-rp-mo-ba3-br100,Tim Larsen,Local Guide · 16 reviews · 17 photos,6 years ago,usually lots dogs completely fenced bins poop bags provided although rarely restocked,,,Like,Share,en
https://lh3.googleusercontent.com/a/ACg8ocLVblAYWa9lFLZ2tAfDHAEuqzfpxjatbfx2sqbiBatMfH2Q5A=w40-h40-p-rp-mo-ba3-br100,Jewellz Gemz,Local Guide · 63 reviews,2 years ago,great place bring pooch fun socialising,,,,Share,en
https://lh3.googleusercontent.com/a-/ALV-UjUg6qbRrSYRAULsYmYM3aOP8JrboIWaiYdIxo4cse3p7wySkryK=w40-h40-p-rp-mo-ba4-br100,Maggie C,Local Guide · 102 reviews · 68 photos,3 years ago,fully enclosed dog park maintained well,,,Like,Share,en
https://lh3.googleusercontent.com/a-/ALV-UjUlg0tNHZ2vh4B18y-O_mCUjSkxZeF3ByiWG5eVlOJXyValzHM=w40-h40-p-rp-mo-br100,Filomena Gilbert,4 reviews,7 years ago,one favourite parks bring dogs run,,,Like,Share,no
https://lh3.googleusercontent.com/a/ACg8ocLZlbmsyxuwsq13xcWjAOU2ImOW-hUxxiGlXH3OhAnyg01pmA=w40-h40-p-rp-mo-ba3-br100,Ben Vucan,Local Guide · 86 reviews · 1 photo,5 years ago,really really good pizza service excellent aswell average wait time max,,,Like,Share,en
https://lh3.googleusercontent.com/a-/ALV-UjXreSc42dZ3pwAR-Emgtg6q05f54iQMuThXdcfWXcEJY3ktCA8H4A=w40-h40-p-rp-mo-ba3-br100,Harish Sundar,Local Guide · 28 reviews · 34 photos,5 years ago,happy dog place,,,Share,Like,nl
https://lh3.googleusercontent.com/a/ACg8ocLNtiAoqF-TMnxqqCYJLc8_gLmWqqpWBMbcxq6-mJrqx7lsgg=w40-h40-p-rp-mo-ba3-br100,Richard C,Local Guide · 41 reviews · 36 photos,5 years ago,well setup dog park get busy maybe dogs,,,Like,Share,da
https://lh3.googleusercontent.com/a/ACg8ocJwCBf0OjOmDSAwruKOldfUTaweO55VDccDQvB5xtuB2OjCGA=w40-h40-p-rp-mo-ba3-br100,Sarah Rouse,Local Guide · 17 reviews,7 years ago,great dog park fully fenced,,,Like,Share,en
https://lh3.googleusercontent.com/a/ACg8ocJ5vcGzDtX3i-0-QyZZYUOrq0sZ5gC4R7EcBgDND2rC2VRWPA=w40-h40-p-rp-mo-ba7-br100,Cliff Shipton,"Local Guide · 863 reviews · 5,614 photos",6 years ago,good facility dogs watch poos,,,Like,Share,en
https://lh3.googleusercontent.com/a-/ALV-UjVILHCz_eTYMVCD0AHUh1qCIntsfqlAVF2dB36pKAP9Q9Zp5b4=w40-h40-p-rp-mo-ba4-br100,Peter,Local Guide · 95 reviews · 2 photos,4 years ago,well organised dog park well natured dogs,,,Like,Share,af
https://lh3.googleusercontent.com/a-/ALV-UjXmCFotCDBRceG52K1DUE0ROmrX5itasTivMpzANFmc1mxSioFd=w40-h40-p-rp-mo-ba5-br100,Michael Baxter,Local Guide · 273 reviews · 289 photos,5 years ago,like take kids said theres much poo park nobody picks anymore,,,Like,Share,en
https://lh3.googleusercontent.com/a/ACg8ocJ4ECHV4_oQG1_D98RAZz8pUE3JIzkpUGUmFqOovmIaRBlDfg=w40-h40-p-rp-mo-br100,Ian Andrew,24 reviews,3 years ago,friendly atmosphere poo bags bins available,,,Like,Share,en
https://lh3.googleusercontent.com/a-/ALV-UjUCDApLuicmVyu6-weT7ZQ775Kxiawuu2DsJr6IWsw-Dyyvsb6EYA=w40-h40-p-rp-mo-ba4-br100,Lohita Goonatilleke,Local Guide · 96 reviews · 10 photos,5 years ago,great place dogs enjoy,,,Like,Share,nl
https://lh3.googleusercontent.com/a/ACg8ocKV1LpvxUaB7onAncD2zq59Dht_VE8qHuAW78XvDbGS0aTx0w=w40-h40-p-rp-mo-br100,Jessie-Christopher-Thomas Gibson,10 reviews · 1 photo,5 years ago,spacious park amongst trees local people great dusk dawn,,,Like,Share,en
https://lh3.googleusercontent.com/a-/ALV-UjWHOu5PncyyAoK3Lr2e41H9_d1hRxkllZxCYTaQEEn-8S5tYZx72Q=w40-h40-p-rp-mo-br100,Mengjie Liu,12 reviews,6 years ago,dog excited see many friends,,,Like,Share,en
https://lh3.googleusercontent.com/a-/ALV-UjUFaWtH4gjMsUmlRvwQeMYxZSeGqhspq68svqNjJE1YPJhMlGg=w40-h40-p-rp-mo-ba5-br100,John Laslett,Local Guide · 565 reviews · 270 photos,6 months ago,great dogs,,,Like,Share,da
https://lh3.googleusercontent.com/a-/ALV-UjWF4JO-vhTnEpTQg6u_5EgPKoJs5d0i_mQt-kLA2n7hTv7PtZ8sag=w40-h40-p-rp-mo-br100,Darren Pauli,145 reviews · 108 photos,7 years ago,fenced well kept area seats taps loads dogggggos,,,,Share,en
https://lh3.googleusercontent.com/a-/ALV-UjUAOznBnV1i06bLdeENnUyzntvnhYuhmeDRD2_DqneLBQlndEf8ig=w40-h40-p-rp-mo-ba4-br100,Brad “Bluey” Weir,Local Guide · 189 reviews · 20 photos,7 years ago,nice area walk dog,,,Like,Share,pl
https://lh3.googleusercontent.com/a-/ALV-UjU3_GKTcNXs4UsLJVT60sGdTFGpYdLlIduUjs1Dpw0t8y0a06-n=w40-h40-p-rp-mo-ba2-br100,Lovers Sassy Gifts North Melbourne,Local Guide · 33 reviews,2 years ago,needs seperation small big dogs,,,Like,Share,da
https://lh3.googleusercontent.com/a/ACg8ocJwzanJ5EDemg20e2hD5kQ3LNmzqFEErLDyUa1EoMQtcs2wxg=w40-h40-p-rp-mo-ba2-br100,Glenn Kennedy,Local Guide · 22 reviews · 12 photos,6 years ago,owners peanuts fantastic,,,Like,Share,en
https://lh3.googleusercontent.com/a-/ALV-UjVkCOV1EVKgnvqDSdyrNBrp5KE-Zs8bDQEN7JHdF0ESI_-PZ6ax=w40-h40-p-rp-mo-ba4-br100,BY C,Local Guide · 118 reviews · 15 photos,4 years ago,owners dont pick pets,,,Like,Share,en
https://lh3.googleusercontent.com/a-/ALV-UjV6vzmpEwidBPirz6jsPXu7bHFIfmXcjRyKXZh2m36BBEKuZWc=w40-h40-p-rp-mo-br100,MrSilver Stag,15 reviews · 1 photo,5 years ago,great environment dogs people,,,Like,Share,da
https://lh3.googleusercontent.com/a/ACg8ocLbjVRPnQMokUc3q8oV7g_JSD0HByRBfSz4XPS_ZI9dgMbTMw=w40-h40-p-rp-mo-ba4-br100,Catherine Cakewalk,Local Guide · 35 reviews · 111 photos,6 years ago,local dog park gets busy days,,,Like,Share,en
https://lh3.googleusercontent.com/a-/ALV-UjUSke8I_H5PMwAmWsz-_G6Z_HCUPTdLdbJ4LV4Qs5YWYJja5Lyw=w40-h40-p-rp-mo-ba5-br100,Bruce Frame,Local Guide · 241 reviews · 7 photos,2 years ago,great place share time dogs,,,Like,Share,en
https://lh3.googleusercontent.com/a/ACg8ocJugA209owwhBeUfaIigpFdy5caL5uQftZPY4UR7HQrllIhS5s=w40-h40-p-rp-mo-ba4-br100,Michael Currie,Local Guide · 70 reviews · 6 photos,2 years ago,mate billy rates place get sniff disgusting things,,,Like,Share,en
https://lh3.googleusercontent.com/a/ACg8ocJsdPlP82fNhkr0G3n2pYh8mTORhW6F7E5Gt2WFxSs-WxMLzg=w40-h40-p-rp-mo-ba3-br100,Maximus,Local Guide · 45 reviews,4 years ago,great park furbaby,,,Like,Share,da
https://lh3.googleusercontent.com/a-/ALV-UjU0eil1cVT-g3AtHN1JF1L_l-lyW7ZVfEcdN2kioITST9W9j6bO=w40-h40-p-rp-mo-ba6-br100,Jake Mullane,Local Guide · 636 reviews · 739 photos,7 years ago,dog park flies issue people forget dog park,,,Like,Share,da
https://lh3.googleusercontent.com/a/ACg8ocL-LJjDziawgmFVXRcLzXt7t1IALfoTgpU9tAcDBwi517xV_g=w40-h40-p-rp-mo-ba4-br100,Jeff M,Local Guide · 161 reviews · 61 photos,5 years ago,didnt visit drove nearbyabout metres away,,,Like,Share,en
https://lh3.googleusercontent.com/a-/ALV-UjXitH-NXIIComqWlv1E4yTpGJXmzP2-Oy2h5kc8_Nv6JVkZukur=w40-h40-p-rp-mo-ba5-br100,Catherine Siluca,"Local Guide · 118 reviews · 1,276 photos",5 years ago,ok parkjust gets crowded alot,,,Like,Share,en
https://lh3.googleusercontent.com/a-/ALV-UjWZCwWReRNBNETKgNMGsA5rqW0uCkKncoDdgBPCOEzkvjFNsqcYWQ=w40-h40-p-rp-mo-ba4-br100,Darwin Tjokro,Local Guide · 124 reviews · 138 photos,2 years ago,great doggos friendly neighbours,,,Like,Share,en
https://lh3.googleusercontent.com/a-/ALV-UjWNF1Wvi9tycqLT5PLfgDx7AddTb5lrbpCmVlCAxrhdOTPyZXtB=w40-h40-p-rp-mo-ba2-br100,Jessie-Khria Gibson,Local Guide · 16 reviews,5 years ago,food van comes lost wallets,,,Like,Share,en
https://lh3.googleusercontent.com/a-/ALV-UjXdPFbrQnX0f9aoqEgHF1qhNYz5ruQgYvSthLc7pLcx-b_7lWgaJA=w40-h40-p-rp-mo-ba5-br100,Moe Sharif,Local Guide · 308 reviews · 377 photos,2 years ago,great park occasions,,,Like,Share,en
https://lh3.googleusercontent.com/a-/ALV-UjWAGCrn964GAROngCgpF9oM2NGebqYMR0_tztNhHu9cSJACzP9L=w40-h40-p-rp-mo-br100,Juan Toscano,24 reviews,8 years ago,awesome four legs friends,,,Like,Share,en
https://lh3.googleusercontent.com/a-/ALV-UjUFtN8V-MLEPCN_iara-jfcQM5SPr9g7jf4dhF4KBSWCSdEo2Y=w40-h40-p-rp-mo-ba4-br100,Tommy Lewis,Local Guide · 93 reviews · 41 photos,5 years ago,fantastic dog park,,,Like,Share,it
https://lh3.googleusercontent.com/a/ACg8ocKARkL4V0aR_i8vkiEIACQw-7OjBZcskekGmecevpESUTEOzQ=w40-h40-p-rp-mo-br100,Kylie Walker,2 reviews,5 years ago,friendly dog park,,,Like,Share,da
https://lh3.googleusercontent.com/a-/ALV-UjVk5eHvI40z0OdUxuBjkTBxNtxq-Z5gnhBi1x2wFWXdxXrhusUJ=w40-h40-p-rp-mo-ba4-br100,Rhece Moore,Local Guide · 89 reviews · 97 photos,4 years ago,awesome space,,,Like,Share,en
https://lh3.googleusercontent.com/a/ACg8ocLc7yMfpa2jN_FQ-zGTGvqC-2vWwre4wBvArjQeLXU9KPpsOw=w40-h40-p-rp-mo-ba4-br100,陳法拉（Cat3）,Local Guide · 102 reviews · 4 photos,2 years ago,course came let dogs loose following came let blood feed mosquitoes,,,Like,Share,en
https://lh3.googleusercontent.com/a-/ALV-UjWg-lg5BNucMZe9VoIi7qHk_W0ntSObz2isq_WG3_vgA6fbZvbf=w40-h40-p-rp-mo-br100,Deanne Van Zanten,1 review · 6 photos,4 years ago,nan,,,,,en
https://lh3.googleusercontent.com/a-/ALV-UjVBGgUIAjLKcbKacxlZH6RjoZuiDd_2CK84WYX-0q3sxqkGp24V=w40-h40-p-rp-mo-ba3-br100,Andrew Wyse,Local Guide · 17 reviews · 90 photos,3 years ago,nan,,,,,en
https://lh3.googleusercontent.com/a/ACg8ocId8p42303gvcyzopZ9Nw-0rt0GhYC0vquPMMnH1LgXjf83yh4=w40-h40-p-rp-mo-ba3-br100,Will Venning,Local Guide · 55 reviews · 25 photos,7 years ago,nan,,,,,en
https://lh3.googleusercontent.com/a-/ALV-UjW9TeCy5dhpLM_WnslEvlPy-7E5Z8azZQds0-tA7wyiMyJdc0Q=w40-h40-p-rp-mo-br100,Mathilda Hsu,9 reviews · 8 photos,3 years ago,nan,,,,,en
https://lh3.googleusercontent.com/a-/ALV-UjUPBoqjNnPGH1ezjBy-bBr3OewJrFUtRrTk9Oy9gpkys-NKqz4Z=w40-h40-p-rp-mo-ba4-br100,Damian May,Local Guide · 5 reviews · 156 photos,3 months ago,nan,,,,,en
https://lh3.googleusercontent.com/a-/ALV-UjXUrNkCLYJFrfYo_phqjOL3lBTvJB_ksuSOqiL3xCVk7zjWslm5=w40-h40-p-rp-mo-ba4-br100,Toby James Foster (Trí Tâm),Local Guide · 120 reviews · 134 photos,3 months ago,nan,,,,,en
https://lh3.googleusercontent.com/a/ACg8ocLali2NufD-BJOQ1vpgaAff1K5eZ3VyzPT2sf9G2hN34v6wB51Z=w40-h40-p-rp-mo-ba6-br100,Shmuel Kaye,"Local Guide · 63 reviews · 2,437 photos",3 months ago,nan,,,,,en
https://lh3.googleusercontent.com/a-/ALV-UjXmRW-5bR0vIsn_dRpMIvQ5t4xviBw2QW8AJGkD88hzv3mBVcs5=w40-h40-p-rp-mo-br100,Lian Jie Ly,4 reviews · 1 photo,7 months ago,nan,,,,,en
https://lh3.googleusercontent.com/a/ACg8ocJwJXyyFJloLx76TvQz69LfX1WM8uqokPusaMXYM-RLNw5sgw=w40-h40-p-rp-mo-br100,Simone Castelli,1 review,8 months ago,nan,,,,,en
https://lh3.googleusercontent.com/a/ACg8ocLnUwTjV17EPqM7jEZM0ce62XWyrqyuPZQHnvL-aogIQH4RCw=w40-h40-p-rp-mo-ba4-br100,Jerry Uy,Local Guide · 35 reviews · 240 photos,8 months ago,nan,,,,,en
https://lh3.googleusercontent.com/a/ACg8ocLmrY8UfDvaMZGBBRTD_t4NNKWnDg2TqgkLsu-ihkakWtXKWA=w40-h40-p-rp-mo-br100,Axel Archenti,14 reviews · 2 photos,9 months ago,nan,,,,,en
https://lh3.googleusercontent.com/a-/ALV-UjVkpJIFIw1yfPJBIKkcaojFe80vzBFx08VFv9wEUAz9f63m8sec=w40-h40-p-rp-mo-br100,Myron Jackomos,2 reviews · 1 photo,10 months ago,nan,,,,,en
https://lh3.googleusercontent.com/a-/ALV-UjWn9hxB9C8dxvCoHDVJOzSmHfATLZ_LCSKFPYnOop6BrRi6MxvG=w40-h40-p-rp-mo-br100,Mel Harrington,1 review,11 months ago,nan,,,,,en
https://lh3.googleusercontent.com/a-/ALV-UjXHQHjpCXW6a8BNyY_H1EGvIBd1cGlEbF2WMc3sQEsc_F0wwje0Ag=w40-h40-p-rp-mo-ba4-br100,Paul Webb,Local Guide · 40 reviews · 280 photos,a year ago,nan,,,,,en
https://lh3.googleusercontent.com/a/ACg8ocIDW_zwEQpiIzFjaZd-wGY97R4iASVjLbZU7Qyj_sMNx1Zmcg=w40-h40-p-rp-mo-ba3-br100,Michelle Shao,Local Guide · 32 reviews · 3 photos,a year ago,nan,,,,,en
https://lh3.googleusercontent.com/a-/ALV-UjUUvfoWP6Dwt1Gv913jDUECzgn1hIlGIBSLf8uP4mJZT6wAO87VYg=w40-h40-p-rp-mo-ba4-br100,Terence Mak,Local Guide · 126 reviews · 350 photos,a year ago,nan,,,,,en
https://lh3.googleusercontent.com/a-/ALV-UjUaubKiZethZ7DJHC-0szSEO6kR5LYSsCzRh6hT2XRD-x62vszg=w40-h40-p-rp-mo-ba3-br100,Tina Nguyen,Local Guide · 25 reviews · 26 photos,a year ago,nan,,,,,en
https://lh3.googleusercontent.com/a-/ALV-UjXJHQHyowLKfUkcMTcRbAyIxw2qaSxLBA8CtvveIS8LHXBDon3QWg=w40-h40-p-rp-mo-br100,Pooja Dhiman,3 reviews,a year ago,nan,,,,,en
https://lh3.googleusercontent.com/a-/ALV-UjUuBd8_FDvKlO7KoaMZX4HHcWLurqANAT6NVEOrSYYtBfDQAA49hw=w40-h40-p-rp-mo-ba4-br100,Claire Best,Local Guide · 70 reviews · 98 photos,a year ago,nan,,,,,en
https://lh3.googleusercontent.com/a-/ALV-UjUhZez2GaB8omrKeF7nRs60nywLUxJJSDsAmKEFInqpaV1YDEeY=w40-h40-p-rp-mo-ba3-br100,Aaron Bertram,Local Guide · 32 reviews,a year ago,nan,,,,,en
https://lh3.googleusercontent.com/a-/ALV-UjU1ShAienhZ4DqBiwtVloFQfYOyqnLXGwhHda6R-wZ0PQ6CTLC4=w40-h40-p-rp-mo-ba4-br100,David Portelli,Local Guide · 82 reviews · 114 photos,a year ago,nan,,,,,en
https://lh3.googleusercontent.com/a-/ALV-UjXBEGcVkHz67i-CqSGkKLHkG0v6Hid5ez6H275Yn5tIu2JjUu2K=w40-h40-p-rp-mo-ba3-br100,Troy Ballantyne,Local Guide · 13 reviews · 37 photos,a year ago,nan,,,,,en
https://lh3.googleusercontent.com/a-/ALV-UjVASN3oqFjOENYMmDc68q1Y70r1yMapXnKb8Jm5KWrgClYI2fl9=w40-h40-p-rp-mo-br100,Travis P,6 reviews,a year ago,nan,,,,,en
https://lh3.googleusercontent.com/a-/ALV-UjU4zcBhahXVpyRrtoPqDsV3TMxUAuNgtwjn1Iqrrw_soHOspmMl=w40-h40-p-rp-mo-br100,Kent Dave Gonzales,17 reviews,a year ago,nan,,,,,en
